id,capacitacion
0, nada
1, ii congreso internacional multidisciplinar de investigadores en formacion cimif curso de introduccion a la mineria de datos con r th internacional conference on digital technologies in education science and industry th internacional conference on digital technologies in education science and industry como agregar reactivos al aula virtual utilizando una plantilla de microsoft word como pasar notas al sga utilizando el libro de calificaciones de la plataforma virtual de aprendizaje de la utm taller como crear un test o evaluacion en linea manejo de grupos entrega de tareas grupales y wiki en el aula virtual utm
2, programa en direccion y gestion de universidades curso internacional en cultura de la investigacion on line modalidad ingenieria y empresa convencion cientifica internacional utm ciudades cognitivas y diseno de universidades cognitivas curriculo en la universidad tecnica de manabi congreso internacional de educacion superior de calidad en el espacio latinoamericano escel comunicacion cientifica para investigadores primeras jornadas posgrado iberoamerica auip
3, jornadas sarteco the th international wireless communications and mobile computing conference the nd ieee international conference on advanced information networking and applications
4, aplicaciones informaticas desarrollo basado en plataforma diseno grafico ofimatica manejo de grupos entrega de tareas grupales y wiki en el aula virtual utm configuracion del libro de calificaciones del aula virtual utm tareas con metodo de calificacion rubrica y extension de plazo en el aula virtual utm preguntas cortas glosario y opciones de gamificacion del aula virtual utm como agregar reactivos al aula virtual utilizando una plantilla de microsoft word diseno y desarrollo de aulas en linea de la utm nivel avanzado formacion para profesores autores de carreras en linea de la utm curso diseno y desarrollo de las aulas en linea de la utm nivel basico
5, mantenimiento avanzado de sistemas de informacion pruebas de software gestion de proyectos de investigacion con pmbok electronica y las tics itsup metodologias para la investigacion ciberseguridad enfoques y tecnologias asociadas primer encuentro nacional de software
6, analisis de datos con power bi ii congreso internacional de ciberseguridad orientaciones basicas para la docencia virtual y diseno de aulas en moodle citic metodologia para la formacion de postgrado bajo la modalidad en linea ciudades cognitivas y diseno de universidades cognitivas python for machine learning ii congreso internacional de educacion inclusiva
7, diseno y utilizacion del e learning en la universidad diseno y desarrollo de las aulas en linea de la utm educacion virtual online para la organizacion de la ensenanza universitaria i conferencia latinoamericana y summer school de analiticas de aprendizaje lala estrategias para evaluar procesos de aprendizaje conferencia edukatic diseno y desarrollo de las aulas en linea de la utm proteja su creacion intelectual
8, v encuentro de graduados de la utm i simposio cientifico internacional del instituto de posgrado de la universidad tecnica de manabi formacion del profesorado en accion tutorial para el seguimiento academico del aprendizaje del estudiantado desde la metodologia de la investigacion accion diseno y desarrollo de las aulas en linea de utm nivel basico ciudades cognitivas y diseno de ciudades cognitivas curso de estrategias innovadoras de aprendizaje clase invertida y aprendizaje orientado a proyectos gestion aprendizaje y buen humor en el aula universitaria seminario taller diseno y utilizacion de e learning en la universidad
9, i encuentro internacional cintifico academico universidad positivaresiliencia y calidad de vida i encuentro internacional cintifico academico universidad positivaresiliencia y calidad de vida primera convencion cientifica internacional de la utm liderazgo en la gestion universitaria software libre para la educacion una experiencia mundial escuelas linux redaccion de articulos cientificos metodologia para la organizacion del proceso de investigacion cientifica procesamiento de lenguaje natural y mineria de texto
10, jornadas academicas cientificas sistema integrado de legislacion ecuatoriana clima y cultura organizacional desarrollo de aplicaiones con herramientas de ta generacion atencion inclusiva a la ciudadania uso estrategico de la web  administracion por procesos manejo de la herramienta visio introduccion a cisco
11, fundamentos teoricos tecnologicos de las criptomonedas metodos estadisticos ciberseguridad enfoque y tecnologias asociadas vii taller internacional la virtualizacion en la educacion superior ii jornadas academicas cientificas ii encuentro de graduados de la universidad tecnica de manabi primera convencion cientifica internacional de la utm manejo y uso de gestores bibliograficos curso teorico practico de redaccion de articulos cientificos
12, introduccion a la mineria de datos con r iii congreso internacional de ciencias informaticas i simposio cientifico internacional del instituto de posgradode la universidad tecnica de manabi curso de formacion continua de desarrollo de aplicaciones web curso de metodos estadisticos curso de metodos de investigacion curso de pedagogia y didactica configuracion de equipos wireless
13, fundamentos teoricos tecnologicos de las criptomonedas ii jornadas academicas cientificas desarrolladas en el ii encuentro a graduados ii jornadas academicas cientificas desarrolladas en el ii encuentro a graduados hardware libre arduino e introduccion a raspberry pi software libre para la educacion una eperiencia mundial escuelas linux curdo teorico practico de redaccion de articulos cientificos metodologia para la organizacion del proceso de investigacion cientifica procesamiento de lenguaje natural y mineria de texto
14, v encuentro de graduados de la utm importar y editar el aula virtual plantilla del diseno y estructura del aula en linea de la utm estrategias innovadoras de aprendizaje ii clase invertida y aprendizaje orientado a proyectos tecnologias aplicadas al campo laboral curso perfil de pares evaluadores gestion de proyectos con pmbok formacion de tutores especializados en nivelacion virtual ciberseguridad enfoques y tecnologias asociadas
15, presentation skills for computer science researchers gestion de la calidad de proyectos de investigacion cientifica con pmbok machine learning aplicado a tecnologias inmersivas para la academia e industria th international conference on technology trends citt programa de reforzamineto academico interacting with perceptual computers introduccion al sistema de recomendaciones
16, v encuentro de graduados de la utm curso de pedagogia y didactica aprobacion diseno de maqueta virtual en d y d para el desarrollo de actividades agroindustriales hidraulicas civiles y agropecuarias instructor
17, metodos y tecnicas de estadistica multivariante diseno de experimentos una actitud saludable procesamiento de lenguaje natural y mineria de texto ingenieria de ontologias paradigmas de investigacion en ciencias del diseno y el metodo estudio de casos teoria y practica seguridad y auditoria introduccion al diseno y analisis de experimentos
18, introduccion a big data curso capacitacion docente en linea sobre gestion del aprendizaje y guias de estudio introduccion a la inteligencia de maquinas introduccion a la mineria de datos con r programa de capacitacion en data science competencias y habilidades pedagogicas en la educacion superior tecnicas y metodologia de estudio para docentes habilidades pedagogicas en la educacion superior
19, procesamiento de lenguaje natural y mineria de texto ingenierias de ontologias paradigma de investigacion en ciencias del diseno y el metodo estudio de casos teoria y practica uso de las tic s en la educacion superior orientaciones metodologicas para generar aprendizajes significativos y funcionales analisis estadisticos con interpretacion de resultados para investigadores introduccion a los sistemas integrados de gestion iso  iso  ohsas convencion cientifica de ingenieria y arquitectura
20, uso de las tic en el proceso formativo universitario fundamentos teoricos tecnologicos de las criptomonedas ciberseguridad enfoques y tecnologias asociadas metodologia de estudios i convencion cientifica internacional utm hardware libre arduino e introduccion a raspberry pi software libre para la educacion escuela linux curso teorico practico redaccion de articulos cientificos
21, internacional conference on digital technologies in education science and industry th internacional conference on digital technologies in education science and industry taller ciudades cognitivas y diseno de universidades cognitivasr curso python for machine learning ii congreso internacional de educacion inclusiva en la universidad ii congreso internacional de educacion inclusiva en la universidad curso data analysis overview congreso internacional y multidisciplinar de investigadores en formacion
22, ii convencion cientifica internacional de la utm administracion de redes y servidores linux i
23, nada
24, v encuentro de graduados de la utm ciberseguridad enfoques y tecnologias asociadas redaccion de articulos cientificos metodologia para la organizacion del proceso de investigacion cientifica procesamiento de lenguaje natural y mineria de texto ingenieria de ontologias ccna modulos iti essentials
25, evaluaciones seguras en moodle con safe exam browser curso de capacitacion docente en linea sobre gestion del aprendizaje y guias de estudio seminario claves para una educacion superior en linea de calidad pasar notas utilizando el libro de calificaciones de la plataforma virtual configuracion del libro de calificaciones del aula virtual utm transact sql basico intermedio y avanzado introduccion a iot programacion paso a paso con java
26, seminario internacional de ciencia de datos curso de capacitacion docente en linea sobre gestion del aprendizaje y guias de estudio v encuentro de graduados de la utm curso de estrategias innovadoras de aprendizajes ii clase invertida y aprendizaje orientados curso de python for machine learning curso de data analysis overview jornadas academicas cientificas desarrollada en el ii encuentro de graduados de la universidad tecnia de manabi curso de gestion de proyectos de investigacion con pmbok
27, ciudades cognitivas python for machine learning data analysis overview curso de seguridad informatica curso de estadistica con r para la investigacion curso de ingles curso de ingles curso de italiano
28, ciberseguridad enfoques y tecnologias asociadas primera convencion cientifica internacional de la utm primera convencion cientifica internacional de la utm iii seminario de ciencia y tecnologia iii seminario de ciencia y tecnologia fundamentos teoricos tecnologicos de las criptomonedas redaccion de articulos cientificos metodologias para la organizacion del proceso de investigacion cientifica
29, nada
30, mantenimiento avanzado de sistemas de informacion pruebas del software gestion de proyectos de investigacion con pmbok fundamentos teoricos y tecnologicos de las criptomonedas cyberseguridad enfoques y tecnologias asociadas participacion como par autoevaluador de carrera redaccion de articulos cientificos metodologia para la organizacion del proceso de investigacion cientifica procesamiento de lenguaje natural y mineria de texto
31, introduccion a terminal y linea de comandos mantenimiento avanzado de sistemas de informacion pruebas del software jornadas academicas cientificas suficiencia manejo de plataformas y entornos virtuales de aprendizaje fundamentos teoricos tecnologicos de las criptomonedas ciberseguridad enfoques y tecnologias asociadas certificado de suficiencia en ingles suficiencia informatica basica
32, medida de visibilidad e impacto de la produccion cientifica visualizacion de grandes volumenes de datos ciberseguridad pedagogia y didactica software libre para la educacion una experiencia mundial de escuela linux seminario taller metodologia para la organizacion del proceso de investigacion tecnologias tcp ip lenguaje natural y mineria de texto
33, curso de capacitacion docente en linea sobre gestion del aprendizaje y guias de estudio v encuentro de graduados de la utm ciudades cognitivas y diseno de universidades cognitivas python for machine learning data analysis overview mantenimiento avanzado de sistemas de informacion pruebas del software iii encuentro de graduados de la universidad tecnica de manabi gestion de proyectos de investigacion con pmbok
